{"schema_version":"1.0.0","project_id":"novel_example","task_id":"draft-ep001","intent":"drafting","required_context":[{"context_id":"canon-current","kind":"canon","question":"Which canon facts constrain episode 1?","sources":["story_bible.json"],"freshness_hours":0},{"context_id":"character-current","kind":"character_state","question":"What is each participant state before the scene?","sources":["character_state.json"],"freshness_hours":24}],"optional_context":[{"context_id":"style-current","kind":"style","question":"Which approved style profile applies?","sources":["style_profile.json"],"freshness_hours":168}],"created_at":"2026-06-20T00:00:00Z"}
