{"schema_version":"1.0.0","project_id":"muhan_regression_remake_10","task_id":"draft-episodes-001-010","intent":"drafting","required_context":[{"context_id":"source-primary","kind":"canon","question":"Which protagonist, world rules, and core ability must remain identical to the designated source?","sources":["sample/무한회귀.txt"],"freshness_hours":0},{"context_id":"canon-current","kind":"canon","question":"Which locked remake canon constrains episodes 1-10?","sources":["projects/muhan_regression_remake_10/story_bible.json"],"freshness_hours":0},{"context_id":"serial-plan","kind":"recent_event","question":"Which state change and ending question belongs to each episode?","sources":["projects/muhan_regression_remake_10/episode_plan_20.json"],"freshness_hours":0}],"optional_context":[],"created_at":"2026-06-22T00:00:00Z"}
